055ab772-5dd5-48dc-9e53-7ba0bbfcc49d,Money talks: Taming crypto,"How do regulators define and tackle crypto-currencies? Professor Mariana Mazzucato explains how economists should measure value.&nbsp; Also, the jeanius of Levi’s denim revival. Helen Joyce hosts  For information regarding your data privacy, visit <a href=""https://www.acast.com/privacy"">acast.com/privacy</a>","Tue, 01 May 2018 14:06:38 GMT",https://media.acast.com/theeconomistmoneytalks/moneytalks-tamingcrypto/media.mp3
055ab772-5dd5-48dc-9e53-7ba0bbfcc49d,Money talks:  Trump makes crude jump,"Our energy and commodities editor, Henry Tricks, looks at how sensitive the commodities markets are to geopolitical comments.  Also, is the Eurozone facing a nasty surprise or is the growth slowdown a temporary blip?&nbsp; And Irish farmers looking for a slice of the European cheese market.   Philip Coggan hosts  For information regarding your data privacy, visit <a href=""https://www.acast.com/privacy"">acast.com/privacy</a>","Tue, 24 Apr 2018 14:27:26 GMT",https://media.acast.com/theeconomistmoneytalks/moneytalks-trumpmakescrudejump/media.mp3
055ab772-5dd5-48dc-9e53-7ba0bbfcc49d,Money talks:  Circling around WPP,"Our media editor, Gady Epstein, assesses the future of the advertising giant WPP after its CEO Sir Martin Sorrell stepped down.&nbsp;Also, should the USPS be privatised? And the latest figures on China’s economy. Helen Joyce hosts  For information regarding your data privacy, visit <a href=""https://www.acast.com/privacy"">acast.com/privacy</a>","Tue, 17 Apr 2018 13:15:03 GMT",https://media.acast.com/theeconomistmoneytalks/moneytalks-circlingaroundwpp/media.mp3
055ab772-5dd5-48dc-9e53-7ba0bbfcc49d,Money Talks: Trade 301,"President Trump’s proposals for tariffs threaten a trade war between America and China. Is there a negotiable way out of the problem? Also, reported merger talks between two legal giants could herald a wave of transatlantic deals. And an assessment of social-safety nets in poorer countries reveals a mixed picture. Helen Joyce hosts.  For information regarding your data privacy, visit <a href=""https://www.acast.com/privacy"">acast.com/privacy</a>","Tue, 10 Apr 2018 20:22:07 GMT",https://media.acast.com/theeconomistmoneytalks/moneytalks-trade301/media.mp3
055ab772-5dd5-48dc-9e53-7ba0bbfcc49d,Money talks: A bumpy ride,"We ask Henry Curr, our US economics editor, if global stockmarket volatility is the new normal.&nbsp; Also, is India’s economy on the right track?  And, the impact of the mobile-phone industry on Vietnam. Helen Joyce hosts  For information regarding your data privacy, visit <a href=""https://www.acast.com/privacy"">acast.com/privacy</a>","Tue, 03 Apr 2018 16:00:36 GMT",https://media.acast.com/theeconomistmoneytalks/moneytalks-abumpyride/media.mp3
055ab772-5dd5-48dc-9e53-7ba0bbfcc49d,Money talks: Trading tit for tat,"Soumaya Keynes, our economics correspondent, explains why the Trump administration’s strategy towards China is risky.&nbsp; Also, are the advertising agency giants doomed? And the economics of Vibranium in Marvel’s “Black Panther” movie.  Helen Joyce hosts  For information regarding your data privacy, visit <a href=""https://www.acast.com/privacy"">acast.com/privacy</a>","Mon, 26 Mar 2018 23:00:00 GMT",https://media.acast.com/theeconomistmoneytalks/moneytalks-tradingtitfortat/media.mp3
055ab772-5dd5-48dc-9e53-7ba0bbfcc49d,Money talks: Yi Gang at the helm,"Our Asia Economics editor, Simon Rabinovitch, analyses what the new boss of China’s central bank means for China's economy.&nbsp;Also, will Dropbox’s IPO filing be a success? And charging the electric-car revolution. Helen Joyce hosts&nbsp;  For information regarding your data privacy, visit <a href=""https://www.acast.com/privacy"">acast.com/privacy</a>","Tue, 20 Mar 2018 20:25:55 GMT",https://media.acast.com/theeconomistmoneytalks/moneytalks-yigangatthehelm-/media.mp3
055ab772-5dd5-48dc-9e53-7ba0bbfcc49d,Money talks: Battle with Beijing,"Simon Rabinovitch, our Asia economics editor, discusses the likely impact of American trade tariffs and Mr Trump’s intervention in the Qualcomm-Broadcom deal on China.&nbsp; And why is America’s health-care system so expensive? Also, can the ""petro"" save Venezuela’s ailing economy? Helen Joyce hosts  For information regarding your data privacy, visit <a href=""https://www.acast.com/privacy"">acast.com/privacy</a>","Tue, 13 Mar 2018 16:13:19 GMT",https://media.acast.com/theeconomistmoneytalks/moneytalks-battlewithbeijing/media.mp3
055ab772-5dd5-48dc-9e53-7ba0bbfcc49d,Money talks: Steely Tariffs,"Are we on the brink of a trade war? Soumaya Keynes, our economics correspondent, explains President Donald Trump’s plans for tariffs on steel and aluminium imports and goes back to basics with Economics 101: Why Trade is Good.&nbsp; Also, do women invest differently to men? Helen Joyce hosts  For information regarding your data privacy, visit <a href=""https://www.acast.com/privacy"">acast.com/privacy</a>","Tue, 06 Mar 2018 18:01:16 GMT",https://media.acast.com/theeconomistmoneytalks/moneytalks-steelytariffs/media.mp3
055ab772-5dd5-48dc-9e53-7ba0bbfcc49d,Money talks: American companies face off with the NRA,"In the aftermath of the Florida shooting, is corporate America being forced to take a stance? Also; Soumaya Keynes speaks to Dani Rodrik, Professor of International Political Economy at Harvard University, about the right way to sell trade deals. &nbsp;And the rapid rise and fall of Anbang. Helen Joyce hosts  For information regarding your data privacy, visit <a href=""https://www.acast.com/privacy"">acast.com/privacy</a>","Tue, 27 Feb 2018 18:08:07 GMT",https://media.acast.com/theeconomistmoneytalks/moneytalks-americancompaniesfaceoffwiththenra/media.mp3
055ab772-5dd5-48dc-9e53-7ba0bbfcc49d,Money talks: The oil club,"Henry Tricks, our energy and commodities editor asks whether the chumminess between oil producing countries will last. Also, how will Facebook tackle the challenges ahead and the unlikely home for the world’s crypto-valley? Helen Joyce hosts  For information regarding your data privacy, visit <a href=""https://www.acast.com/privacy"">acast.com/privacy</a>","Tue, 20 Feb 2018 21:09:04 GMT",https://media.acast.com/theeconomistmoneytalks/moneytalks-theoilclub/media.mp3
055ab772-5dd5-48dc-9e53-7ba0bbfcc49d,Money talks: Lessons from Norway,"10 years on, what can we learn from the Norwegian quota for female corporate directors?&nbsp; Also: A tale of two chip-makers and a mammoth hostile takeover bid — Qualcomm and Broadcom.&nbsp; And, what is threatening old-fashioned customer service in Japan?  Simon Long hosts  For information regarding your data privacy, visit <a href=""https://www.acast.com/privacy"">acast.com/privacy</a>","Tue, 13 Feb 2018 00:00:00 GMT",https://media.acast.com/theeconomistmoneytalks/moneytalks-lessonsfromnorway/media.mp3
055ab772-5dd5-48dc-9e53-7ba0bbfcc49d,Money talks: Crash course,"Is the plunge in global asset prices a meaningless blip or something more serious? Also, why the UK should care about the trade deals it’s about to lose. And how non-alcoholic drinks are the biggest opportunity in the market. Hosted by Simon Long.  For information regarding your data privacy, visit <a href=""https://www.acast.com/privacy"">acast.com/privacy</a>","Tue, 06 Feb 2018 17:36:18 GMT",https://media.acast.com/theeconomistmoneytalks/moneytalks-crashcourse/media.mp3
055ab772-5dd5-48dc-9e53-7ba0bbfcc49d,Money talks: Car talks,"Soumaya Keynes, our economics correspondent, asks why cars are the sticking point in the NAFTA negotiations.&nbsp; Also Simon Long, our finance editor, interviews Lord Jim O’Neill, former Goldman Sachs economist and BRICS man.&nbsp; Is he a China bull and does he think Goldmans will catch up with Morgan Stanley?  For information regarding your data privacy, visit <a href=""https://www.acast.com/privacy"">acast.com/privacy</a>","Tue, 30 Jan 2018 15:25:12 GMT",https://media.acast.com/theeconomistmoneytalks/moneytalks-cartalks/media.mp3
055ab772-5dd5-48dc-9e53-7ba0bbfcc49d,Money talks: A seismic shift on Wall Street,"Morgan Stanley v Goldman Sachs: is dullness the key to success for America's investment banks? Also, is mandatory arbitration the best way to deal with problem bosses? And, why medicinal cannabis in Germany is in short supply. Simon Long hosts.  For information regarding your data privacy, visit <a href=""https://www.acast.com/privacy"">acast.com/privacy</a>","Tue, 23 Jan 2018 14:59:13 GMT",https://media.acast.com/theeconomistmoneytalks/moneytalks-aseismicshiftonwallstreet/media.mp3
055ab772-5dd5-48dc-9e53-7ba0bbfcc49d,The World In 2018: Money makes the World In go round,"Anne McElvoy and Daniel Franklin return with another special looking forward to the year ahead. This week, they tackle business and economics. Patrick Foulis looks back at a prediction for last year, and looks ahead to the year for American firms; correspondents from across Asia make their predictions for emerging markets; investors weigh in on how Brexit looks from China and why it could be a big year for big cars  For information regarding your data privacy, visit <a href=""https://www.acast.com/privacy"">acast.com/privacy</a>","Tue, 16 Jan 2018 00:00:00 GMT",https://media.acast.com/theeconomistmoneytalks/theworldin2018-moneymakestheworldingoround/media.mp3
055ab772-5dd5-48dc-9e53-7ba0bbfcc49d,Money talks:  Cracking steel — hammer or chisel?,"Could we be on the brink of President Trump’s first real trade war over Chinese steel? Also, why the great Indian middle class may not be as big as you think.&nbsp;And, is the gym business in good shape? Simon Long hosts.  For information regarding your data privacy, visit <a href=""https://www.acast.com/privacy"">acast.com/privacy</a>","Tue, 09 Jan 2018 16:12:42 GMT",https://media.acast.com/theeconomistmoneytalks/moneytalks-crackingsteel-hammerorchisel-/media.mp3
055ab772-5dd5-48dc-9e53-7ba0bbfcc49d,"Money talks: New year, new economics?","We cajole our economics editors, John O’Sullivan and Henry Curr, to make predictions for 2018. Also, Soumaya Keynes asks how can the field of economics attract more women? Simon Long hosts.  For information regarding your data privacy, visit <a href=""https://www.acast.com/privacy"">acast.com/privacy</a>","Tue, 02 Jan 2018 13:11:24 GMT",https://media.acast.com/theeconomistmoneytalks/moneytalks-newyear-neweconomics-/media.mp3
055ab772-5dd5-48dc-9e53-7ba0bbfcc49d,Money talks: We have to ask about money!,"We take a look back at 2017 — headaches at Uber, a new way to learn Economics, butter shortages in France and behavioural economics with Michael Lewis.&nbsp;Also, Latin lessons from J Balvin. Simon Long hosts.  For information regarding your data privacy, visit <a href=""https://www.acast.com/privacy"">acast.com/privacy</a>","Tue, 26 Dec 2017 18:33:31 GMT",https://media.acast.com/theeconomistmoneytalks/moneytalks-wehavetoaskaboutmoney-/media.mp3
055ab772-5dd5-48dc-9e53-7ba0bbfcc49d,Money Talks: The Quiz,"Andrew Palmer, Simon Long and Rachana Shanbhogue answer tough questions about finance and economics and fight for prizes. Philip Coggan is our quizmaster supremo.  For information regarding your data privacy, visit <a href=""https://www.acast.com/privacy"">acast.com/privacy</a>","Tue, 19 Dec 2017 14:56:29 GMT",https://media.acast.com/theeconomistmoneytalks/moneytalks-thequiz/media.mp3
055ab772-5dd5-48dc-9e53-7ba0bbfcc49d,"Money talks: Once bitcoined, twice…","Philip Coggan, our Buttonwood columnist, asks if we should worry about the freakish rises in cryptocurrency prices.  Also, Businesses leave Catalonia in the face of political uncertainty.&nbsp; And the Jedi effect: can the remake save Hollywood? Simon Long hosts.  For information regarding your data privacy, visit <a href=""https://www.acast.com/privacy"">acast.com/privacy</a>","Tue, 12 Dec 2017 18:00:07 GMT",https://media.acast.com/theeconomistmoneytalks/moneytalks-oncebitcoined-twice-/media.mp3
055ab772-5dd5-48dc-9e53-7ba0bbfcc49d,Money talks: A Christmas gift for the president,"We digest the ambitious overhaul of the American tax system and whether the bill will become law by Christmas. And Soumaya Keynes talks to the EU Commissioner for Trade about how the EU is trying to keep China in check. Also market exuberance: shall we dance? Simon Long hosts.  For information regarding your data privacy, visit <a href=""https://www.acast.com/privacy"">acast.com/privacy</a>","Tue, 05 Dec 2017 17:57:24 GMT",https://media.acast.com/theeconomistmoneytalks/moneytalks-achristmasgiftforthepresident/media.mp3
055ab772-5dd5-48dc-9e53-7ba0bbfcc49d,Money talks: Company politics,"We ask not whether companies will play a more political role but how expansive that role might be?&nbsp; And, how cheese tells us all we need to know about the economics of trade.&nbsp; Also, how giving your company a Chinese name is tricky business.&nbsp; Simon Long hosts.  For information regarding your data privacy, visit <a href=""https://www.acast.com/privacy"">acast.com/privacy</a>","Tue, 28 Nov 2017 14:54:49 GMT",https://media.acast.com/theeconomistmoneytalks/moneytalks-companypolitics/media.mp3
055ab772-5dd5-48dc-9e53-7ba0bbfcc49d,Money talks: Feeding frenzy for 21st Century Fox,"As Disney and others eye up the sale of 21st Century Fox’s entertainment assets — our media editor Gady Epstein asks why Rupert Murdoch is breaking up his empire.&nbsp; Are Millennials forcing a step change in socially-responsible investing? And a fishy story of herrings in Holland.&nbsp;Simon Long hosts.  For information regarding your data privacy, visit <a href=""https://www.acast.com/privacy"">acast.com/privacy</a>","Tue, 21 Nov 2017 16:35:40 GMT",https://media.acast.com/theeconomistmoneytalks/moneytalks-feedingfrenzyfor21stcenturyfox/media.mp3
055ab772-5dd5-48dc-9e53-7ba0bbfcc49d,Money talks: Can you say CPTPP?,"Only three days into his term, President Trump withdrew from the Trans-Pacific Partnership. Now, the remaining 11 countries are forming a new trade deal called the CPTPP. Host Philip Coggan and Soumaya Keynes speculate whether China might join, now that America is out. Plus why there’s geopolitical tension in the oil market. And Michael Lewis talks about his new book.  For information regarding your data privacy, visit <a href=""https://www.acast.com/privacy"">acast.com/privacy</a>","Tue, 14 Nov 2017 15:59:14 GMT",https://media.acast.com/theeconomistmoneytalks/moneytalks-canyousaycptpp-/media.mp3
055ab772-5dd5-48dc-9e53-7ba0bbfcc49d,Money talks: ICO Bubble with benefits,"Our Technology Editor, Ludwig Siegele, says that despite the froth, Initial Coin Offerings could challenge the dominance of the tech giants.&nbsp; Also, will Venezuela finally default on its debt and how are markets reacting to the arrest of the Saudi Warren Buffet? Simon Long hosts.  For information regarding your data privacy, visit <a href=""https://www.acast.com/privacy"">acast.com/privacy</a>","Tue, 07 Nov 2017 16:59:01 GMT",https://media.acast.com/theeconomistmoneytalks/moneytalks-icobubblewithbenefits/media.mp3
055ab772-5dd5-48dc-9e53-7ba0bbfcc49d,Money talks: A healthy deal?,"Is Amazon’s rumoured entry into the pharma market the real impetus behind the CVS Health and Aetna deal? And Barry Eichengreen, Economist from the University of California, questions how long the dollar can stay dominant.  Also, how is France coping with a butter shortage? Simon Long hosts.  For information regarding your data privacy, visit <a href=""https://www.acast.com/privacy"">acast.com/privacy</a>","Tue, 31 Oct 2017 15:43:00 GMT",https://media.acast.com/theeconomistmoneytalks/moneytalks-ahealthydeal-/media.mp3
055ab772-5dd5-48dc-9e53-7ba0bbfcc49d,Money talks: Wait and See MPC,"Callum Williams, our Britain economics correspondent, argues that the Bank of England should raise interest rates early next year rather than next week.&nbsp; Nobel Economist Jean Tirole shares his worries about competition in the digital economy.  And driving from right to left in Myanmar.&nbsp; Philip Coggan hosts.  For information regarding your data privacy, visit <a href=""https://www.acast.com/privacy"">acast.com/privacy</a>","Tue, 24 Oct 2017 16:23:00 GMT",https://media.acast.com/theeconomistmoneytalks/moneytalks-waitandseempc/media.mp3
055ab772-5dd5-48dc-9e53-7ba0bbfcc49d,Money talks: Tense trading,"Soumaya Keynes, our economics correspondent, discusses whether President Trump's drastic proposals will break the NAFTA trade pact.&nbsp;Also: Why IBM’s recovery is incomplete and a rare glimpse into the HQ of the German retailer Aldi. Simon long hosts.  For information regarding your data privacy, visit <a href=""https://www.acast.com/privacy"">acast.com/privacy</a>","Wed, 18 Oct 2017 18:15:00 GMT",https://media.acast.com/theeconomistmoneytalks/moneytalks-tensetrading/media.mp3
055ab772-5dd5-48dc-9e53-7ba0bbfcc49d,Money talks: A nudge in the right direction,"We discuss the winner of this year's Nobel in economics, Richard Thaler. Ukraine's finance minister speaks to us about the battle against corruption, and reforming the beleaguered country. Also, the banks that look like software companies  For information regarding your data privacy, visit <a href=""https://www.acast.com/privacy"">acast.com/privacy</a>","Tue, 10 Oct 2017 17:24:00 GMT",https://media.acast.com/theeconomistmoneytalks/moneytalks-anudgeintherightdirection/media.mp3
055ab772-5dd5-48dc-9e53-7ba0bbfcc49d,Money talks: Can the emerging-markets boom continue?,"The Economist’s Simon Cox argues emerging markets are more resilient these days, and are less tied to the US Fed's interest-rate decisions.&nbsp; Also, how big is the gender gap in pensions? And the buzz around the Jiophone launch in India. Simon Long hosts.  For information regarding your data privacy, visit <a href=""https://www.acast.com/privacy"">acast.com/privacy</a>","Tue, 03 Oct 2017 17:13:00 GMT",https://media.acast.com/theeconomistmoneytalks/moneytalks-cantheemerging-marketsboomcontinue-/media.mp3
055ab772-5dd5-48dc-9e53-7ba0bbfcc49d,Money talks: How have markets been reacting to Merkel’s tentative victory?,"<span style=""color: rgb(0, 0, 0); font-family: Arial; font-size: 12.8px;"">Adam Roberts, our European business correspondent, analyses how German companies have reacted to the return of the far-right in German politics.&nbsp; Also, will London ban the ride-sharing company Uber and we get excited about some boring-sounding new rules for finance, MiFiD II.&nbsp; Simon Long hosts.  For information regarding your data privacy, visit <a href=""https://www.acast.com/privacy"">acast.com/privacy</a>","Tue, 26 Sep 2017 15:00:00 GMT",https://media.acast.com/theeconomistmoneytalks/moneytalks-howhavemarketsbeenreactingtomerkel-stentativevictory-/media.mp3
055ab772-5dd5-48dc-9e53-7ba0bbfcc49d,Money talks: Latin lessons from J Balvin,"Reggaeton is a genre of music topping the charts across the world. Colombian artist J Balvin joins host Simon Long to discuss why streaming services have played such a vital role in spreading the word. Plus, why Chinese unicorns are worth more than American ones. And could a better economics textbooks help us predict the next recession?&nbsp;   For information regarding your data privacy, visit <a href=""https://www.acast.com/privacy"">acast.com/privacy</a>","Tue, 19 Sep 2017 17:30:00 GMT",https://media.acast.com/theeconomistmoneytalks/moneytalks-latinlessonsfromjbalvin/media.mp3
055ab772-5dd5-48dc-9e53-7ba0bbfcc49d,Money talks: Donald Trump’s moment to shape the Fed,"Henry Curr, our US economics editor, discusses how President Trump will fill the four vacant seats on the board of the American Federal Reserve. Also, a big data breach at the credit-scoring company, Equifax, puts millions at risk. And the contradiction at the heart of China’s internet giants. Simon Long hosts.  For information regarding your data privacy, visit <a href=""https://www.acast.com/privacy"">acast.com/privacy</a>","Tue, 12 Sep 2017 16:31:00 GMT",https://media.acast.com/theeconomistmoneytalks/moneytalks-donaldtrump-smomenttoshapethefed/media.mp3
055ab772-5dd5-48dc-9e53-7ba0bbfcc49d,Money talks: Markets unrattled by North Korea,"<span style=""font-size: 12.8px; color: rgb(0, 0, 0); font-family: Arial;"">Philip Coggan explains why markets appear so calm in the face of North Korea’s nuclear threat. Also, are China’s capacity cuts for real? And how technology is making banking more inclusive. Simon Long hosts.  For information regarding your data privacy, visit <a href=""https://www.acast.com/privacy"">acast.com/privacy</a>","Tue, 05 Sep 2017 16:50:00 GMT",https://media.acast.com/theeconomistmoneytalks/moneytalks-marketsunrattledbynorthkorea/media.mp3
055ab772-5dd5-48dc-9e53-7ba0bbfcc49d,Money talks: Will Uber’s new CEO restore the company’s image and culture?,"<span style=""color: rgb(0, 0, 0); font-family: Arial; font-size: 13.3333px;"">Uber has finally chosen its new CEO: Dara Khosrowshahi, the boss of Expedia. Will he be able to drive the company away from its recent crises? Also, a glimpse into the once secretive world of Cargill, an American agribusiness giant.&nbsp;And do people migrate when taxes rise? Simon Long hosts.  For information regarding your data privacy, visit <a href=""https://www.acast.com/privacy"">acast.com/privacy</a>","Tue, 29 Aug 2017 18:10:00 GMT",https://media.acast.com/theeconomistmoneytalks/moneytalks-willuber-snewceorestorethecompany-simageandculture-/media.mp3
055ab772-5dd5-48dc-9e53-7ba0bbfcc49d,Money talks: Summer special,"In this episode, we do summer stock-taking and highlight some popular items of the year so far. From amazing Amazon - and how it became one of the world's most valuable companies - to the burgeoning business of illegal sand mining.  For information regarding your data privacy, visit <a href=""https://www.acast.com/privacy"">acast.com/privacy</a>","Tue, 22 Aug 2017 17:20:00 GMT",https://media.acast.com/theeconomistmoneytalks/moneytalks-summerspecial/media.mp3
055ab772-5dd5-48dc-9e53-7ba0bbfcc49d,Money talks: Tricky trading,"<span style=""color: rgb(34, 34, 34); font-family: arial, sans-serif; font-size: 12.8px;"">As NAFTA trade talks begin, we examine whether a deal can be made and discuss the investigation President Trump has ordered into China's trading practices. Artificial intelligence often gets a bad rap but could it create as many jobs as it takes? Plus, how fidget spinners have transformed the toy industry.  For information regarding your data privacy, visit <a href=""https://www.acast.com/privacy"">acast.com/privacy</a>","Tue, 15 Aug 2017 14:05:00 GMT",https://media.acast.com/theeconomistmoneytalks/moneytalks-trickytrading/media.mp3
055ab772-5dd5-48dc-9e53-7ba0bbfcc49d,Money talks: Silicon sexism,"<span style=""color: rgb(34, 34, 34); font-family: arial, sans-serif; font-size: 12.8px;"">Google fires a software engineer after his anti-diversity memo was leaked. However, this points&nbsp;to wider culture wars in Silicon Valley. Janet Yellen’s term watching over America’s central bank will end in February. We look at possible candidates. And how Say's law, a 200 year-old economic theory, still has relevance today. Simon Long hosts.﻿  For information regarding your data privacy, visit <a href=""https://www.acast.com/privacy"">acast.com/privacy</a>","Tue, 08 Aug 2017 17:01:00 GMT",https://media.acast.com/theeconomistmoneytalks/siliconsexism/media.mp3
055ab772-5dd5-48dc-9e53-7ba0bbfcc49d,"Money talks: Billion dollar TV deal, Becker and Beckham","<span style=""font-size: 10pt; font-family: Arial; color: rgb(0, 0, 0);"">Discovery Communications and Scripps Network team up to fight the competition. Also on the show: Why are economists so interested in human capital? And David Beckham’s Miami soccer dream might finally be realised.  For information regarding your data privacy, visit <a href=""https://www.acast.com/privacy"">acast.com/privacy</a>","Tue, 01 Aug 2017 18:10:00 GMT",https://media.acast.com/theeconomistmoneytalks/moneytalks-billiondollartvdeal-beckerandbeckham/media.mp3
055ab772-5dd5-48dc-9e53-7ba0bbfcc49d,Money talks: International monetary fun,"<span style=""color: rgb(34, 34, 34); font-family: arial, sans-serif; font-size: 12.8px;"">Host Philip Coggan and guests discuss the economic futures of the UK and USA,both of which&nbsp;have had their prospects downgraded in the International Monetary Fund’s updated World Economic Outlook. Also: the recent compromise ending a so-called Bitcoin ""civil war"".  For information regarding your data privacy, visit <a href=""https://www.acast.com/privacy"">acast.com/privacy</a>","Tue, 25 Jul 2017 16:12:00 GMT",https://media.acast.com/theeconomistmoneytalks/moneytalks-internationalmonetaryfun/media.mp3
055ab772-5dd5-48dc-9e53-7ba0bbfcc49d,Money talks: Goodbye Benito,"<strong style=""font-size: 12.8px; font-family: arial, sans-serif; color: rgb(34, 34, 34);"">Brazil’s rigid labour market regulations were transplanted wholesale from Benito Mussolini’s Italy back in 1943. Now President Michel Temer has approved&nbsp;&nbsp;an overhaul. Will it encourage job creation? Also, an exorcist in Paris fighting “bad spirits”. And why President Trump is playing hardball in renegotiating NAFTA. Hosted by Andrew Palmer.  For information regarding your data privacy, visit <a href=""https://www.acast.com/privacy"">acast.com/privacy</a>","Tue, 18 Jul 2017 16:18:00 GMT",https://media.acast.com/theeconomistmoneytalks/moneytalks-goodbyebenito/media.mp3
