055ab772-5dd5-48dc-9e53-7ba0bbfcc49d,Money talks: Boeing grounded,"Several countries have grounded Boeing’s 737 Max after two catastrophic crashes. What are the precedents and can the business recover? Also, as China’s giant current-account surplus vanishes, could this lead to the Chinese economy opening up? And Volkswagen announces plans to cut jobs as it launches a fleet of new electric cars. Simon Long hosts  For information regarding your data privacy, visit <a href=""https://www.acast.com/privacy"">acast.com/privacy</a>","Tue, 12 Mar 2019 19:14:23 GMT",https://media.acast.com/theeconomistmoneytalks/moneytalks-boeinggrounded/media.mp3
055ab772-5dd5-48dc-9e53-7ba0bbfcc49d,Money talks: Winter is coming,"How a once white-hot tech sector in China is shedding capital, employees and bonuses and heading for a freeze. Plane stupid — a look at the private jet industry and why airlines are phasing out first class seats. Also, Jim Collins, author of the best seller ‘Good to Great’, explains the flywheel principle. Simon Long hosts  For information regarding your data privacy, visit <a href=""https://www.acast.com/privacy"">acast.com/privacy</a>","Tue, 05 Mar 2019 16:30:00 GMT",https://media.acast.com/theeconomistmoneytalks/moneytalks-winteriscoming/media.mp3
055ab772-5dd5-48dc-9e53-7ba0bbfcc49d,Money talks: No magic sauce,"Could Kraft Heinz’s troubles signal the limits of cost-cutting and the strategies of 3G Capital? Germany’s Deutsche Bank is struggling, but merging might not be the right answer. Sallie Krawcheck, a titan of Wall Street, who once thought social impact investing was for “granola eaters”, now tells us companies should be less dominated by white males. Simon Long hosts  For information regarding your data privacy, visit <a href=""https://www.acast.com/privacy"">acast.com/privacy</a>","Tue, 26 Feb 2019 17:01:14 GMT",https://media.acast.com/theeconomistmoneytalks/moneytalks-nomagicsauce/media.mp3
055ab772-5dd5-48dc-9e53-7ba0bbfcc49d,Money talks: B&B — Brexit and Business,"It is not yet clear how Britain will leave the European Union on March 29th. But for companies that have to ship stuff to the other side of the world, Brexit has already arrived. What are British companies doing to prepare themselves for Brexit and what effect will this have on the British economy? Richard Cockett hosts  For information regarding your data privacy, visit <a href=""https://www.acast.com/privacy"">acast.com/privacy</a>","Tue, 19 Feb 2019 17:27:03 GMT",https://media.acast.com/theeconomistmoneytalks/moneytalks-b-b-brexitandbusiness/media.mp3
055ab772-5dd5-48dc-9e53-7ba0bbfcc49d,"Money talks: A billionaire, a scandal and business…","The world’s richest man, Amazon boss Jeff Bezos fights back against the Enquirer.&nbsp;Tackling the challenge of the ""pink"" and ""blue"" jobs market — should the employment market be more ""purple""?&nbsp;And on a scale of 1 to 10, how useful are employee surveys? Simon Long hosts  For information regarding your data privacy, visit <a href=""https://www.acast.com/privacy"">acast.com/privacy</a>","Tue, 12 Feb 2019 17:37:44 GMT",https://media.acast.com/theeconomistmoneytalks/moneytalks-abillionaire-ascandalandbusiness-/media.mp3
055ab772-5dd5-48dc-9e53-7ba0bbfcc49d,Money talks: Crude awakening,"ExxonMobil is pursuing an aggressive plan for oil investment. Charlotte Howard, our energy editor, explains why. Also, Brian Roberts, CEO of Comcast has a record of wrong-footing critics—can he do so again? And the producers of China’s ancient liquor, baijiu, plan to go global. Host Simon Long tastes it.  For information regarding your data privacy, visit <a href=""https://www.acast.com/privacy"">acast.com/privacy</a>","Tue, 05 Feb 2019 16:30:00 GMT",https://media.acast.com/theeconomistmoneytalks/moneytalks-crudeawakening/media.mp3
055ab772-5dd5-48dc-9e53-7ba0bbfcc49d,Money talks: Calming down hyperinflation,"With the economic turmoil crippling Venezuela, we ask what can be done to bring a quick resolution to hyperinflation? Also, the Chinese giant grain producer that is threatening the global industry. And yet another controversy for the credit-default swap. Simon Long hosts  For information regarding your data privacy, visit <a href=""https://www.acast.com/privacy"">acast.com/privacy</a>","Tue, 29 Jan 2019 16:55:39 GMT",https://media.acast.com/theeconomistmoneytalks/moneytalks-calmingdownhyperinflation/media.mp3
055ab772-5dd5-48dc-9e53-7ba0bbfcc49d,Money talks: Achtung maybe?,"Is Germany's economy on the brink of a recession? And Professor Amy Edmondson, author of “The Fearless Organisation”, examines the importance of speaking up in the workplace. Also, remembering John Clifton ""Jack"" Bogle, patron saint of the amateur investor. Philip Coggan hosts  For information regarding your data privacy, visit <a href=""https://www.acast.com/privacy"">acast.com/privacy</a>","Tue, 22 Jan 2019 14:13:16 GMT",https://media.acast.com/theeconomistmoneytalks/moneytalks-achtungmaybe-/media.mp3
055ab772-5dd5-48dc-9e53-7ba0bbfcc49d,Money talks: Cost of the shutdown,"Will the government shutdown in America cause long-lasting economic damage? Henry Tricks reports on how robots and automation will help Chinese firms cope with rising wages and the trade war. Also, what fuelled the huge growth of Canada's state pension fund and what can it teach other countries? Philip Coggan hosts  For information regarding your data privacy, visit <a href=""https://www.acast.com/privacy"">acast.com/privacy</a>","Tue, 15 Jan 2019 17:19:23 GMT",https://media.acast.com/theeconomistmoneytalks/moneytalks-costoftheshutdown/media.mp3
055ab772-5dd5-48dc-9e53-7ba0bbfcc49d,Money talks: The Euro at 20,"As the Euro turns 20 years old, we look back at its launch and ask what the future holds for the currency. After Apple announced it was cutting its quarterly revenue forecast, we discuss whether peak smartphone has been reached. And, Vice President of Twitter, Bruce Daisley, tells us to turn off phone notifications and how to increase the joy of work. Philip Coggan hosts  For information regarding your data privacy, visit <a href=""https://www.acast.com/privacy"">acast.com/privacy</a>","Tue, 08 Jan 2019 16:16:41 GMT",https://media.acast.com/theeconomistmoneytalks/moneytalks-theeuroat20/media.mp3
055ab772-5dd5-48dc-9e53-7ba0bbfcc49d,Money talks: Bright economic stars,"Who are the world’s most exciting young economists? Every ten years, since 1988, The Economist has chosen those whose innovative research is likely to shape our future. Their work varies from the science of education choices to the economics of the weather. In the past, the list has included Nobel laureate Paul Krugman, Freakonomics’ Steven Levitt and Esther Duflo. Our host, Soumaya Keynes, takes a road trip to meet four of the most promising economists of the decade: Stefanie Stantcheva, Melissa Dell, Parag Pathak and Emi Nakamura. Music: Coming Home by TeknoAXE CC by 4.0  For information regarding your data privacy, visit <a href=""https://www.acast.com/privacy"">acast.com/privacy</a>","Tue, 01 Jan 2019 11:00:00 GMT",https://media.acast.com/theeconomistmoneytalks/moneytalks-brighteconomicstars/media.mp3
055ab772-5dd5-48dc-9e53-7ba0bbfcc49d,Money talks: The Christmas jamboree,"The Economist’s Vijay Vaitheeswaran, Charlotte Howard and NPR’s Cardiff Garcia join host Philip Coggan for our celebration of the business, finance and economics highlights and lowlights of 2018.  For information regarding your data privacy, visit <a href=""https://www.acast.com/privacy"">acast.com/privacy</a>","Tue, 18 Dec 2018 10:52:41 GMT",https://media.acast.com/theeconomistmoneytalks/moneytalks-thechristmasjamboree/media.mp3
055ab772-5dd5-48dc-9e53-7ba0bbfcc49d,Money talks: Huawei in the spotlight,"The Chinese tech company at the centre of the American - China trade war.&nbsp;How illicit trade is threatening our future with guest Professor Louise Shelley. And the exclusive and influential part of the financial landscape reserved for billionaires. Simon Long hosts.  For information regarding your data privacy, visit <a href=""https://www.acast.com/privacy"">acast.com/privacy</a>","Tue, 11 Dec 2018 21:35:57 GMT",https://media.acast.com/theeconomistmoneytalks/moneytalks-huaweiinthespotlight/media.mp3
055ab772-5dd5-48dc-9e53-7ba0bbfcc49d,Money talks: Easing into a recovery?,"As the ECB brings an end to quantitative easing, is Europe’s economic recovery underway? How, despite the glamour of its fashion show, Victoria’s Secret is struggling to keep up with rivals. And the problem of online fraud in America. Simon Long hosts  For information regarding your data privacy, visit <a href=""https://www.acast.com/privacy"">acast.com/privacy</a>","Tue, 04 Dec 2018 15:34:34 GMT",https://media.acast.com/theeconomistmoneytalks/moneytalks-easingintoarecovery-/media.mp3
055ab772-5dd5-48dc-9e53-7ba0bbfcc49d,"Money talks: Going, going, Ghosn","We discuss General Motors’ plans to halt production at five factories in North America and cut more than 14,000 jobs. Also, what next for Nissan, Mitsubishi Motors and Renault after Carlos Ghosn was arrested on suspicion of financial misconduct and dismissed from his post as chairman? And, the challenges facing new pub landlords in Ireland. Philip Coggan hosts.  For information regarding your data privacy, visit <a href=""https://www.acast.com/privacy"">acast.com/privacy</a>","Tue, 27 Nov 2018 15:04:21 GMT",https://media.acast.com/theeconomistmoneytalks/moneytalks-going-going-ghosn/media.mp3
055ab772-5dd5-48dc-9e53-7ba0bbfcc49d,Money talks: Trump’s Economics Adviser,"We speak to Kevin Hassett, Chairman of the President’s Council of Economic Advisers about the American economy.
Helen Joyce hosts.  For information regarding your data privacy, visit <a href=""https://www.acast.com/privacy"">acast.com/privacy</a>","Tue, 20 Nov 2018 14:36:40 GMT",https://media.acast.com/theeconomistmoneytalks/moneytalks-trump-seconomicsadviser/media.mp3
055ab772-5dd5-48dc-9e53-7ba0bbfcc49d,Money talks: Monopolies and boardroom games,"How powerful firms could undermine public faith in capitalism. Shakespearean drama in Nokia’s boardroom. And most businesses are ramping up their holiday hiring, but where will they find workers? Simon Long hosts. 
Music by TeknoAXE CC by 4.0 (Cello Zen, The Cold of the Night)  For information regarding your data privacy, visit <a href=""https://www.acast.com/privacy"">acast.com/privacy</a>","Tue, 13 Nov 2018 16:25:41 GMT",https://media.acast.com/theeconomistmoneytalks/moneytalks-monopoliesandboardroomgames/media.mp3
055ab772-5dd5-48dc-9e53-7ba0bbfcc49d,Money talks: Mid-term matters,"As Americans go to the polls, how will Mr. Trump's economic policies play out in the mid-term elections? Who will benefit from America's opportunity zones? And, the buzz around the SEC and what business bosses really think about President Trump. 
Simon Long hosts  For information regarding your data privacy, visit <a href=""https://www.acast.com/privacy"">acast.com/privacy</a>","Tue, 06 Nov 2018 17:36:22 GMT",https://media.acast.com/theeconomistmoneytalks/moneytalks-mid-termmatters/media.mp3
055ab772-5dd5-48dc-9e53-7ba0bbfcc49d,Money talks: End of Austerity?,"Analysis of Britain's budget with our Britain economics correspondent.&nbsp;What is driving the fall in tech stocks? And, is Harley Davidson struggling to fire on all cylinders?
Helen Joyce hosts. Sound effect: THE_bizniss (cc x 3.0)  For information regarding your data privacy, visit <a href=""https://www.acast.com/privacy"">acast.com/privacy</a>","Tue, 30 Oct 2018 16:47:30 GMT",https://media.acast.com/theeconomistmoneytalks/moneytalks-endofausterity-/media.mp3
055ab772-5dd5-48dc-9e53-7ba0bbfcc49d,Money talks: China jitters,"Is China’s slowing economic growth a cause for concern and will the market jitters spread? Amazon moves into digital advertising in a big way. And, our very own super-hero Captain Sensible takes us on a tour of effective economic policies.&nbsp;Rachana Shanbhogue hosts. Music: Super Hero by TeknoAXE (CC x 4.0)  For information regarding your data privacy, visit <a href=""https://www.acast.com/privacy"">acast.com/privacy</a>","Tue, 23 Oct 2018 15:35:13 GMT",https://media.acast.com/theeconomistmoneytalks/moneytalks-chinajitters/media.mp3
055ab772-5dd5-48dc-9e53-7ba0bbfcc49d,Money talks: Sears of change,"Sears, the giant of American retail, goes bankrupt. The shale boom has made America the world’s top oil producer: is it sustainable?&nbsp;And is Weight Watchers over “weight”?  Helen Joyce hosts  For information regarding your data privacy, visit <a href=""https://www.acast.com/privacy"">acast.com/privacy</a>","Tue, 16 Oct 2018 17:12:09 GMT",https://media.acast.com/theeconomistmoneytalks/moneytalks-searsofchange/media.mp3
055ab772-5dd5-48dc-9e53-7ba0bbfcc49d,Money talks:  How do you solve a problem like Brasilia?,"The next president of Brazil will inherit a public-finance crisis. Far-right populist Jair Bolsonaro is on track to win - what are the implications if he's elected?&nbsp;Britain’s crackdown on dirty money. And the challenges of overcoming another global recession. Helen Joyce hosts.  For information regarding your data privacy, visit <a href=""https://www.acast.com/privacy"">acast.com/privacy</a>","Tue, 09 Oct 2018 12:36:46 GMT",https://media.acast.com/theeconomistmoneytalks/moneytalks-howdoyousolveaproblemlikebrasilia-/media.mp3
055ab772-5dd5-48dc-9e53-7ba0bbfcc49d,Money talks: Musk do better!,"Could Italy’s new budget plans lead to a fresh Eurozone crisis? Elon Musk versus the regulators. And the challenges of replacing the LIBOR rate.
Helen Joyce hosts. Music adapted from track by The Waiters (CC by 3.0 UK)  For information regarding your data privacy, visit <a href=""https://www.acast.com/privacy"">acast.com/privacy</a>","Tue, 02 Oct 2018 11:39:15 GMT",https://media.acast.com/theeconomistmoneytalks/moneytalks-muskdobetter-/media.mp3
055ab772-5dd5-48dc-9e53-7ba0bbfcc49d,Money talks: Sky’s the limit,"The impact on the media industry of Comcast’s blowout bid for Sky.&nbsp;What has changed in the corporate world in the wake of the #MeToo movement? And the annoying CEO habits you might not want to emulate.&nbsp;Andrew Palmer hosts  For information regarding your data privacy, visit <a href=""https://www.acast.com/privacy"">acast.com/privacy</a>","Tue, 25 Sep 2018 16:35:24 GMT",https://media.acast.com/theeconomistmoneytalks/moneytalks-sky-sthelimit/media.mp3
055ab772-5dd5-48dc-9e53-7ba0bbfcc49d,Money talks: Tariffic!,"More Trump tariffs, how is China likely to retaliate? Historian Lord Skidelsky challenges mainstream economic ideas. And the hopes and hurdles for South Korean businesses eyeing up opportunities in North Korea. Philip Coggan hosts  For information regarding your data privacy, visit <a href=""https://www.acast.com/privacy"">acast.com/privacy</a>","Tue, 18 Sep 2018 13:18:40 GMT",https://media.acast.com/theeconomistmoneytalks/moneytalks-tariffic-/media.mp3
055ab772-5dd5-48dc-9e53-7ba0bbfcc49d,Money Talks: The Lehman Lessons,"Ten years on from the collapse of Lehman Brothers, we examine what progress has been made.&nbsp;Are we prepared for the next global financial crisis? Helen Joyce hosts  For information regarding your data privacy, visit <a href=""https://www.acast.com/privacy"">acast.com/privacy</a>","Tue, 11 Sep 2018 09:05:14 GMT",https://media.acast.com/theeconomistmoneytalks/moneytalks-thelehmanlessons/media.mp3
055ab772-5dd5-48dc-9e53-7ba0bbfcc49d,Money talks: Crumbling currencies,"How are the governments in Argentina and Turkey responding to their financial and economic crises? Samir Desai, the CEO and cofounder of funding circle, explains why he’s going public. And what are the biggest threats to the global smartphone supply chain?&nbsp; Helen Joyce hosts  For information regarding your data privacy, visit <a href=""https://www.acast.com/privacy"">acast.com/privacy</a>","Tue, 04 Sep 2018 15:02:00 GMT",https://media.acast.com/theeconomistmoneytalks/moneytalks-crumblingcurrencies/media.mp3
055ab772-5dd5-48dc-9e53-7ba0bbfcc49d,Money talks: NAFTA — alive or dead?,"Has there been a breakthrough in efforts to revamp the NAFTA trade agreement? Henry Tricks, our commodities editor, explains recent falls in commodity prices. And how did YouTube profit from the biggest amateur boxing match of all time?&nbsp; Andrew Palmer hosts.  For information regarding your data privacy, visit <a href=""https://www.acast.com/privacy"">acast.com/privacy</a>","Tue, 28 Aug 2018 16:49:57 GMT",https://media.acast.com/theeconomistmoneytalks/moneytalks-nafta-aliveordead-/media.mp3
055ab772-5dd5-48dc-9e53-7ba0bbfcc49d,Money talks: Chopping zeros off the Bolivar,"What effect will President Maduro’s desperate measures have on the Venezuelan economy? Stephen Gibbs reports from Caracas. Also on the show: how can companies protect themselves against intangible risks and dealing with congestion in cities.&nbsp;Andrew Palmer hosts.  For information regarding your data privacy, visit <a href=""https://www.acast.com/privacy"">acast.com/privacy</a>","Tue, 21 Aug 2018 15:52:54 GMT",https://media.acast.com/theeconomistmoneytalks/moneytalks-choppingzerosoffthebolivar/media.mp3
055ab772-5dd5-48dc-9e53-7ba0bbfcc49d,Money talks:  Sick as a Turkey,"Are Turkey's currency troubles contagious? The weed-killer court case that could have worldwide impact. And why Tiger Woods still has the power to roar Andrew Palmer hosts  For information regarding your data privacy, visit <a href=""https://www.acast.com/privacy"">acast.com/privacy</a>","Tue, 14 Aug 2018 16:06:13 GMT",https://media.acast.com/theeconomistmoneytalks/moneytalks-sickasaturkey/media.mp3
055ab772-5dd5-48dc-9e53-7ba0bbfcc49d,Money talks: Urban outbidders,"Property prices in the world’s most desirable cities have sped away from those elsewhere but what has caused that trend, and will it last? And how governments are limiting foreign investment in tech companies to reduce China's influence. Also, a new decentralised app for prediction markets. Helen Joyce hosts  For information regarding your data privacy, visit <a href=""https://www.acast.com/privacy"">acast.com/privacy</a>","Tue, 07 Aug 2018 13:07:07 GMT",https://media.acast.com/theeconomistmoneytalks/moneytalks-urbanoutbidders/media.mp3
055ab772-5dd5-48dc-9e53-7ba0bbfcc49d,Money talks:  Greek Lessons,"Should the Bank of England raise interest rates this week? &nbsp;&nbsp;As Greece prepares to exit its bail-out, what are the lessons to be learned from the crisis?&nbsp; And open-plan offices - do they work?  Helen Joyce hosts  For information regarding your data privacy, visit <a href=""https://www.acast.com/privacy"">acast.com/privacy</a>","Tue, 31 Jul 2018 12:16:57 GMT",https://media.acast.com/theeconomistmoneytalks/moneytalks-greeklessons/media.mp3
055ab772-5dd5-48dc-9e53-7ba0bbfcc49d,Money talks: One Belt One Road,"What now for Fiat Chrysler after Sergio Marchionne’s departure? How America and Europe are tightening rules on foreign direct investments. And China’s Belt and Road Initiative - a benevolent gift to connect the world or a highway to world dominance? &nbsp;Helen Joyce hosts  For information regarding your data privacy, visit <a href=""https://www.acast.com/privacy"">acast.com/privacy</a>","Tue, 24 Jul 2018 14:06:04 GMT",https://media.acast.com/theeconomistmoneytalks/moneytalks-onebeltoneroad/media.mp3
055ab772-5dd5-48dc-9e53-7ba0bbfcc49d,Money talks: W-T-Oh,"How can world leaders fix the World Trade Organisation? Also, we discuss the runners and riders to replace Mario Draghi as president of the European Central Bank. And, after the World Cup in Russia why is the football transfer market unusually quiet? Helen Joyce hosts  For information regarding your data privacy, visit <a href=""https://www.acast.com/privacy"">acast.com/privacy</a>","Tue, 17 Jul 2018 13:11:03 GMT",https://media.acast.com/theeconomistmoneytalks/moneytalks-w-t-oh/media.mp3
055ab772-5dd5-48dc-9e53-7ba0bbfcc49d,Money talks:  Make trade not war,"Is there a way out of trade war? The US tariffs and the global repercussions. 
Bringing electricity to the remotest and poorest parts of the world - are mini-grids the answer? And is WeWork worth its $20bn valuation?
Helen Joyce hosts  For information regarding your data privacy, visit <a href=""https://www.acast.com/privacy"">acast.com/privacy</a>","Tue, 10 Jul 2018 13:18:27 GMT",https://media.acast.com/theeconomistmoneytalks/moneytalks-maketradenotwar/media.mp3
055ab772-5dd5-48dc-9e53-7ba0bbfcc49d,Money talks: Trolley wars,"What will Tesco and Carrefour’s strategic alliance mean for customers and suppliers? Stan Pignal reports on why women in India have dropped out of the workforce.&nbsp; And CO2 shortages in the UK hit the beer industry.  Philip Coggan hosts  For information regarding your data privacy, visit <a href=""https://www.acast.com/privacy"">acast.com/privacy</a>","Tue, 03 Jul 2018 14:47:32 GMT",https://media.acast.com/theeconomistmoneytalks/moneytalks-trolleywars/media.mp3
055ab772-5dd5-48dc-9e53-7ba0bbfcc49d,Money talks: Netflixonomics,"Gady Epstein explores how Netflix has grown into a global entertainment network and asks Netflix’s CEO Reed Hastings about power and responsibility.&nbsp;Also, is government outsourcing a toxic model that can’t be rescued? And could you lead the country of Petronia after its discovery of oil? Helen Joyce hosts  For information regarding your data privacy, visit <a href=""https://www.acast.com/privacy"">acast.com/privacy</a>","Tue, 26 Jun 2018 17:29:57 GMT",https://media.acast.com/theeconomistmoneytalks/moneytalks-netflixonomics/media.mp3
055ab772-5dd5-48dc-9e53-7ba0bbfcc49d,Money talks: Drums of trade war,"As fears mount of a trade war between China and America, David Rennie looks at how China is preparing.&nbsp;And as part of our Open Future season, we explore how tax systems could be improved. Also, the electric bike business is riding high.&nbsp;Helen Joyce hosts  For information regarding your data privacy, visit <a href=""https://www.acast.com/privacy"">acast.com/privacy</a>","Tue, 19 Jun 2018 16:25:57 GMT",https://media.acast.com/theeconomistmoneytalks/moneytalks-drumsoftradewar/media.mp3
055ab772-5dd5-48dc-9e53-7ba0bbfcc49d,Money talks: G7 handshakes at dawn,"How President Trump turned his back on the G7 summit joint agreement. Sir Paul Tucker, former Deputy Governor of the Bank of England, tells us when power should be delegated to technocrats. &nbsp;&nbsp;And can the solar industry survive without subsidies?  For information regarding your data privacy, visit <a href=""https://www.acast.com/privacy"">acast.com/privacy</a>","Tue, 12 Jun 2018 14:23:04 GMT",https://media.acast.com/theeconomistmoneytalks/moneytalks-g7handshakesatdawn/media.mp3
055ab772-5dd5-48dc-9e53-7ba0bbfcc49d,Money talks:  How to top Trump?,"How should allies stand up to President Trump’s trade tariffs? We talk to Professor Kate Pickett about the link between inequality and anxiety in her sequel to The Spirit Level.&nbsp; And Renting The Runway - is shopping for clothes going out of style? Andrew Palmer hosts  For information regarding your data privacy, visit <a href=""https://www.acast.com/privacy"">acast.com/privacy</a>","Tue, 05 Jun 2018 15:44:31 GMT",https://media.acast.com/theeconomistmoneytalks/moneytalks-howtotoptrump-/media.mp3
055ab772-5dd5-48dc-9e53-7ba0bbfcc49d,Money talks: The Italian problem,"Our economic editor, Henry Curr, looks at the threat Italy’s political crisis poses to the euro zone.&nbsp;And Ludwig Siegele, our technology editor, asks Glen Weyl, author of ""Radical Markets"", why he wants to expand the role of markets and how a new wealth tax could work.&nbsp;Helen Joyce hosts.&nbsp;Music by Chris Zabriskie “Divider” (CC by 4.0 UK)  For information regarding your data privacy, visit <a href=""https://www.acast.com/privacy"">acast.com/privacy</a>","Tue, 29 May 2018 17:14:39 GMT",https://media.acast.com/theeconomistmoneytalks/moneytalks-theitalianproblem/media.mp3
055ab772-5dd5-48dc-9e53-7ba0bbfcc49d,Money talks: Is Trump jump-starting business?,"Are US businesses happy with the Trump Era? Do we need to break the cosy relationship between auditors and their clients?&nbsp;And why large companies are choosing to invest in Central Europe. Philip Coggan hosts  For information regarding your data privacy, visit <a href=""https://www.acast.com/privacy"">acast.com/privacy</a>","Tue, 22 May 2018 14:08:15 GMT",https://media.acast.com/theeconomistmoneytalks/moneytalks-istrumpjump-startingbusiness-/media.mp3
055ab772-5dd5-48dc-9e53-7ba0bbfcc49d,Money talks: Sanction Buster - who you gonna call?,"The implications of President Trump’s U-turn on Telecoms giant ZTE. Tamzin Booth explains why Masayoshi Son could be the most influential man in the Tech world. And how non-compete clauses are gumming up the US economy. Helen Joyce hosts  For information regarding your data privacy, visit <a href=""https://www.acast.com/privacy"">acast.com/privacy</a>","Tue, 15 May 2018 13:09:13 GMT",https://media.acast.com/theeconomistmoneytalks/moneytalks-sanctionbuster-whoyougonnacall-/media.mp3
055ab772-5dd5-48dc-9e53-7ba0bbfcc49d,Money talks: Don’t bank with me Argentina,"As Argentina starts talks with the IMF, we ask why Argentina’s currency crisis is causing financial wobbles in other emerging markets.? Simon Long explores whether digital technology can reach people who don’t have access to bank accounts. And, Philip Coggan transforms into Dr Who and looks back at 12 years of his Buttonwood column.&nbsp;Helen Joyce hosts  For information regarding your data privacy, visit <a href=""https://www.acast.com/privacy"">acast.com/privacy</a>","Tue, 08 May 2018 16:09:10 GMT",https://media.acast.com/theeconomistmoneytalks/moneytalks-don-tbankwithmeargentina/media.mp3
