055ab772-5dd5-48dc-9e53-7ba0bbfcc49d,Money talks: Getting bizzy,"Ahead of the UK’s general election, party leaders courted businesses at the annual conference of the Confederation of British Industry. We ask the CBI’s chief economist Rain Newton-Smith what attendees made of their proposals. Also, Scott Kupor of Andreessen Horowitz reveals the secrets of success in the world of venture capitalism. And, why the future of gaming is in the cloud. Rachana Shanbhogue hosts
&nbsp;
Please subscribe to The Economist for full access to print, digital and audio editions:
www.economist.com/radiooffer  For information regarding your data privacy, visit <a href=""https://www.acast.com/privacy"">acast.com/privacy</a>","Tue, 19 Nov 2019 18:56:38 GMT",https://media.acast.com/theeconomistmoneytalks/moneytalks-gettingbizzy/media.mp3
055ab772-5dd5-48dc-9e53-7ba0bbfcc49d,Money talks: Streams come true,"Disney Plus enters the battle of the streaming services, amongst competition from Netflix, Apple, Amazon and others. Which will achieve the Hollywood ending? And we ask Peter Navarro, President Trump’s trade advisor, what the endgame is in negotiations with China. Also, why our Bartleby columnist hates videoconferencing. Helen Joyce hosts&nbsp;
&nbsp;
Please subscribe to The Economist for full access to print, digital and audio editions:
www.economist.com/radiooffer  For information regarding your data privacy, visit <a href=""https://www.acast.com/privacy"">acast.com/privacy</a>","Tue, 12 Nov 2019 18:33:27 GMT",https://media.acast.com/theeconomistmoneytalks/moneytalks-streamscometrue/media.mp3
055ab772-5dd5-48dc-9e53-7ba0bbfcc49d,Money talks: Unhappy EUnion,"Opposition to the European Central Bank’s plans for quantitative easing has been split along North-South lines in the euro zone. But are these concerns justified? And, journalist and author Matthew Syed explains why thinking is more creative in organisations where the staff are diverse. Also, our Wall Street correspondent, Alice Fulwood, plays a round of poker with player and entrepreneur Bryn Kenney, who tops the world’s All-Time Money List. Simon Long hosts


Please subscribe to The Economist for full access to print, digital and audio editions:
www.economist.com/radiooffer  For information regarding your data privacy, visit <a href=""https://www.acast.com/privacy"">acast.com/privacy</a>","Tue, 05 Nov 2019 17:21:01 GMT",https://media.acast.com/theeconomistmoneytalks/moneytalks-unhappyeunion/media.mp3
055ab772-5dd5-48dc-9e53-7ba0bbfcc49d,Money talks: HSBC change,"HSBC’s third-quarter results have revealed a “disappointing” performance in Europe and America. What has caused problems for the global bank? Also, Saudi Aramco, the state-owned oil firm, looks likely to push forward with plans for an IPO. What challenges does the oil giant face? And Julian Richer, founder of the entertainment retailer Richer Sounds, on the secret to keeping staff happy. Simon Long hosts


Please subscribe to The Economist for full access to print, digital and audio editions:
www.economist.com/radiooffer  For information regarding your data privacy, visit <a href=""https://www.acast.com/privacy"">acast.com/privacy</a>","Tue, 29 Oct 2019 16:56:14 GMT",https://media.acast.com/theeconomistmoneytalks/moneytalks-hsbcchange/media.mp3
055ab772-5dd5-48dc-9e53-7ba0bbfcc49d,Money talks: Wells Far(to)go,"The new boss of Wells Fargo has an unenviable to-do list. Our Wall Street correspondent sizes up Charlie Scharf’s prospects for rehabilitating the bank after a series of scandals. Senator Elizabeth Warren is now leading the pack of Democratic candidates for the American presidency. Would her plans reshape American capitalism for better or worse? And, can money really buy happiness? Patrick Lane hosts
____________________
Please subscribe to The Economist for full access to print, digital and audio editions:
www.economist.com/radiooffer
____________________  For information regarding your data privacy, visit <a href=""https://www.acast.com/privacy"">acast.com/privacy</a>","Tue, 22 Oct 2019 18:00:28 GMT",https://media.acast.com/theeconomistmoneytalks/moneytalks-wellsfar-to-go/media.mp3
055ab772-5dd5-48dc-9e53-7ba0bbfcc49d,Money talks: A Nobel endeavour,"What causes poverty? Rachana Shanbhogue interviews this year’s winners of the Nobel prize for economics—Esther Duflo, Abhijit Banerjee and Michael Kremer. Their pioneering work has changed the understanding of one of the hardest problems in economics: why do some countries grow rich while others stay poor? Plus, Europe’s Nordic banks are embroiled in money-laundering scandals. What do regulators need to do to restore confidence?  For information regarding your data privacy, visit <a href=""https://www.acast.com/privacy"">acast.com/privacy</a>","Tue, 15 Oct 2019 18:45:05 GMT",https://media.acast.com/theeconomistmoneytalks/moneytalks-anobelendeavour/media.mp3
055ab772-5dd5-48dc-9e53-7ba0bbfcc49d,Money talks: How low can rates go?,"Our economics editor, Henry Curr, explores why the global economy is behaving weirdly and how governments and central banks should respond. Also, can freer trade help address climate change? The Economist’s editor-in-chief, Zanny Minton-Beddoes, asks Jacinda Ardern, the prime minister of New Zealand, Cecilia Malmström, the EU’s trade commissioner, Michael Corbat, CEO of Citigroup, and Tidjane Thiam, CEO of Credit Suisse, at the Bloomberg Global Business Forum. And, how the economics of streaming is changing pop songs. Helen Joyce hosts  For information regarding your data privacy, visit <a href=""https://www.acast.com/privacy"">acast.com/privacy</a>","Tue, 08 Oct 2019 15:56:31 GMT",https://media.acast.com/theeconomistmoneytalks/moneytalks-howlowcanratesgo-/media.mp3
055ab772-5dd5-48dc-9e53-7ba0bbfcc49d,Money talks: WeWorry,"WeWork has scrapped plans for an initial public offering after its CEO stepped down amid claims of mismanagement. What does its implosion mean for investors and other young firms with similar ambitions? Greece's new government is preparing to announce its first draft budget. Will it be enough to re-energise the economy? Plus, a taste of Chinese fine wine. Patrick Lane hosts  For information regarding your data privacy, visit <a href=""https://www.acast.com/privacy"">acast.com/privacy</a>","Tue, 01 Oct 2019 18:14:06 GMT",https://media.acast.com/theeconomistmoneytalks/moneytalks-weworry/media.mp3
055ab772-5dd5-48dc-9e53-7ba0bbfcc49d,Money talks: Planet Inc,"What are the risks businesses face from climate change? And, Kate Raworth, economist and educator, explains “doughnut economics” and says rich economies are addicted to “unending growth”. Who are the billionaires hoping to make big bucks from climate change? Also, we hear from the finalists of The Economist’s Open Future essay competition who sought an effective response to climate change. Simon Long hosts&nbsp;


Additional music by Chris Zabriskie ""Divider"" (CC by 4.0)


____________________
Please subscribe to The Economist for full access to print, digital and audio editions:
www.economist.com/radiooffer
____________________  For information regarding your data privacy, visit <a href=""https://www.acast.com/privacy"">acast.com/privacy</a>","Tue, 24 Sep 2019 15:22:27 GMT",https://media.acast.com/theeconomistmoneytalks/moneytalks-planetinc/media.mp3
055ab772-5dd5-48dc-9e53-7ba0bbfcc49d,Money talks: Purpose vs profit,"What are companies for? The orthodoxy was that they exist primarily to pursue profit. But a new faith in higher corporate purpose as a means to address social injustice, climate change and inequality is sweeping the Western business world. How much is this trend of “reverse Friedmanism” going to change what it means to do business? Or could chief executives playing politics have dangerous consequences? Tamzin Booth hosts  For information regarding your data privacy, visit <a href=""https://www.acast.com/privacy"">acast.com/privacy</a>","Tue, 17 Sep 2019 18:30:08 GMT",https://media.acast.com/theeconomistmoneytalks/moneytalks-purposevsprofit/media.mp3
055ab772-5dd5-48dc-9e53-7ba0bbfcc49d,Money talks: Fannie and Freddie move house,"The US Treasury plans to privatise Fannie Mae and Freddie Mac, which prop up most of the country’s mortgage finance. How will this affect the US mortgage market? Also, despite legislation aimed at blocking a no-deal Brexit, Britain could still leave the EU without a deal. The Bank of England is weighing up its options for how to deal with the consequences. And, how important are coaches to sporting success? Simon Long hosts  For information regarding your data privacy, visit <a href=""https://www.acast.com/privacy"">acast.com/privacy</a>","Tue, 10 Sep 2019 18:00:03 GMT",https://media.acast.com/theeconomistmoneytalks/moneytalks-fannieandfreddiemovehouse/media.mp3
055ab772-5dd5-48dc-9e53-7ba0bbfcc49d,Money talks: Hell to peso,"Argentina’s President has imposed currency controls in an attempt to stabilise the markets, as the country faces escalating financial troubles. How did things go so wrong so quickly? And what next? The Economist’s Soumaya Keynes asks Binyamin Appelbaum, author of “The Economists’ Hour”, what impact economists have had on public policy. Also, why are older people not retiring? Simon Long hosts  For information regarding your data privacy, visit <a href=""https://www.acast.com/privacy"">acast.com/privacy</a>","Tue, 03 Sep 2019 15:08:55 GMT",https://media.acast.com/theeconomistmoneytalks/moneytalks-helltopeso/media.mp3
055ab772-5dd5-48dc-9e53-7ba0bbfcc49d,Money talks: Big pharma in court,"The pharmaceutical giant Johnson & Johnson has been ordered to pay $572 million for its part in the opioid crisis in the state of Oklahoma. What precedent will this set? In Jackson Hole, Federal Reserve Bank of St. Louis President James Bullard explains how the escalation of trade tensions is affecting monetary policy and he reacts to President Trump’s adversarial style. And finally, some funny business. Simon Long hosts  For information regarding your data privacy, visit <a href=""https://www.acast.com/privacy"">acast.com/privacy</a>","Tue, 27 Aug 2019 17:29:03 GMT",https://media.acast.com/theeconomistmoneytalks/moneytalks-bigpharmaincourt/media.mp3
055ab772-5dd5-48dc-9e53-7ba0bbfcc49d,Money talks: From bad to wurst,"This week the Bundesbank warned that Germany’s economy will probably soon be in recession. Henry Curr, our economics editor, argues that the country needs more fiscal stimulus. Who will buy the world’s largest AI computer chip? And, Apple's entry into the credit card market. Simon Long hosts  For information regarding your data privacy, visit <a href=""https://www.acast.com/privacy"">acast.com/privacy</a>","Tue, 20 Aug 2019 18:44:55 GMT",https://media.acast.com/theeconomistmoneytalks/moneytalks-frombadtowurst/media.mp3
055ab772-5dd5-48dc-9e53-7ba0bbfcc49d,Money talks: Delayed tariffication,"President Trump has delayed some tariffs on Chinese imports. Soumaya Keynes, our US economics editor, explains the surprise decision and its implications for the global economy. Also, is data as valuable an asset as oil? What can companies learn from the oil industry about keeping data safe? And, the secrets of success for online fashion retailers. Rachana Shanbogue hosts  For information regarding your data privacy, visit <a href=""https://www.acast.com/privacy"">acast.com/privacy</a>","Tue, 13 Aug 2019 18:30:00 GMT",https://media.acast.com/theeconomistmoneytalks/moneytalks-delayedtariffication/media.mp3
055ab772-5dd5-48dc-9e53-7ba0bbfcc49d,Money talks: Yuan-a fight?,"President Donald Trump has accused China of being a currency manipulator, after the Chinese currency “po qi” or “cracked 7” against the US dollar— a psychologically significant value—for the first time in over a decade. How will this escalation of the US-China trade war affect global markets? Also, how useful are yield curves for predicting future recessions? And, life without Uber. Rachana Shanbhogue presents.  For information regarding your data privacy, visit <a href=""https://www.acast.com/privacy"">acast.com/privacy</a>","Tue, 06 Aug 2019 15:48:38 GMT",https://media.acast.com/theeconomistmoneytalks/moneytalks-yuan-afight-/media.mp3
055ab772-5dd5-48dc-9e53-7ba0bbfcc49d,Money talks: Warren of Wall Street,"Can US Senator Elizabeth Warren convince Wall Street to back her and how are the other candidates faring in the Democratic competition for the 2020 presidential nomination? And, David Autor, an economist at MIT, speaks to Money Talks about how computers changed the US labour market, the impact of China and his gecko brand. Also, will the world follow Sweden’s lead and go cashless? Simon Long hosts  For information regarding your data privacy, visit <a href=""https://www.acast.com/privacy"">acast.com/privacy</a>","Tue, 30 Jul 2019 16:51:40 GMT",https://media.acast.com/theeconomistmoneytalks/moneytalks-warrenofwallstreet/media.mp3
055ab772-5dd5-48dc-9e53-7ba0bbfcc49d,Money talks: Europe’s bright spots,"A few resilient countries and sectors have helped cushion the effects of a trade and manufacturing slowdown on the euro zone. But can that continue? Also, Tyler Cowen, an economist and blogger, stands up for big business. And, it’s all in the small print – why it matters that consumers neither read nor understand the contracts they sign. Simon Long hosts  For information regarding your data privacy, visit <a href=""https://www.acast.com/privacy"">acast.com/privacy</a>","Tue, 23 Jul 2019 17:00:56 GMT",https://media.acast.com/theeconomistmoneytalks/moneytalks-europe-sbrightspots/media.mp3
055ab772-5dd5-48dc-9e53-7ba0bbfcc49d,Money talks: How slow can you grow?,"Last week’s episode asked how long American economic growth could last. Now, new figures reveal that China’s growth is the slowest in nearly three decades. What can the Chinese government do about it? Insurance companies make their money from predicting disaster, but as those risks change the industry is lagging behind.&nbsp;And England has won the Cricket World Cup in a controversial tiebreak––but are tiebreaks fair? Simon Long hosts  For information regarding your data privacy, visit <a href=""https://www.acast.com/privacy"">acast.com/privacy</a>","Tue, 16 Jul 2019 18:30:00 GMT",https://media.acast.com/theeconomistmoneytalks/moneytalks-howslowcanyougrow-/media.mp3
055ab772-5dd5-48dc-9e53-7ba0bbfcc49d,Money talks: When the growing gets tough,"America’s economy has been expanding for 121 months in a row—unemployment is low and the stock market has soared. But how long can this last? History suggests a painful recession might be around the corner. Nobel prizewinner and economics professor Joseph Stiglitz tells us capitalism is broken. And, what is an economist's secret to affordable tickets to Wimbledon? Rachana Shanbhogue hosts  For information regarding your data privacy, visit <a href=""https://www.acast.com/privacy"">acast.com/privacy</a>","Tue, 09 Jul 2019 16:50:46 GMT",https://media.acast.com/theeconomistmoneytalks/moneytalks-whenthegrowinggetstough/media.mp3
055ab772-5dd5-48dc-9e53-7ba0bbfcc49d,Money talks: Brexit and the City,"London is home to the world’s biggest international financial centre. But Brexit threatens to cut the City off from its most important single foreign market. Tamzin Booth, The Economist’s Britain business editor, investigates whether the City of London can survive Brexit and how other cities across Europe, like Frankfurt, are vying to win their rival’s business. What is at stake on both sides of the Channel, and are there any winners in this battle?&nbsp;  For information regarding your data privacy, visit <a href=""https://www.acast.com/privacy"">acast.com/privacy</a>","Tue, 02 Jul 2019 19:00:00 GMT",https://media.acast.com/theeconomistmoneytalks/moneytalks-brexitandthecity/media.mp3
055ab772-5dd5-48dc-9e53-7ba0bbfcc49d,Money talks: Bargaining chips,"The trade war between America and China is intensifying after America blacklisted five more Chinese technology entities. Will this jeopardise any talk of a trade deal at the upcoming G20 summit? Could low-denomination treasury bills help Italy’s cash-strapped economy? Also, a new way of working called “ghost work”. Phil Coggan hosts  For information regarding your data privacy, visit <a href=""https://www.acast.com/privacy"">acast.com/privacy</a>","Tue, 25 Jun 2019 17:48:31 GMT",https://media.acast.com/theeconomistmoneytalks/moneytalks-bargainingchips/media.mp3
055ab772-5dd5-48dc-9e53-7ba0bbfcc49d,Money talks: Banking bad,"Deutsche Bank plans to create a new division, a “bad bank”, which will hold tens of billions of euros of assets as part of an overhaul of it is operations. Will the remaining firm become profitable enough to satisfy regulators and investors? And the growing concern in China over balancing the books at a local level. Also, our correspondent takes a trip to Citeco — France’s museum of economics. Patrick Foulis hosts  For information regarding your data privacy, visit <a href=""https://www.acast.com/privacy"">acast.com/privacy</a>","Tue, 18 Jun 2019 15:23:41 GMT",https://media.acast.com/theeconomistmoneytalks/moneytalks-bankingbad/media.mp3
055ab772-5dd5-48dc-9e53-7ba0bbfcc49d,Money talks: All the presidents men,"There are no women in the running to take over as the next President of the European Central Bank. And, lessons from the Woodford Investment group—even star fund-managers can struggle to outperform the market. Also, why do German billionaires avoid the limelight? Simon Long hosts  For information regarding your data privacy, visit <a href=""https://www.acast.com/privacy"">acast.com/privacy</a>","Tue, 11 Jun 2019 15:55:28 GMT",https://media.acast.com/theeconomistmoneytalks/moneytalks-allthepresidentsmen/media.mp3
055ab772-5dd5-48dc-9e53-7ba0bbfcc49d,Money talks: Tariffs at dawn,"President Trump has started using import tariffs to win political as well as economic battles. What will be the impact of his latest threats to impose tariffs on Mexican goods? Also, how the US Federal Reserve is preparing for the next recession. And, how a toxic working environment can poison lives even among do-gooders. Simon Long hosts  For information regarding your data privacy, visit <a href=""https://www.acast.com/privacy"">acast.com/privacy</a>","Tue, 04 Jun 2019 15:58:54 GMT",https://media.acast.com/theeconomistmoneytalks/moneytalks-tariffsatdawn/media.mp3
055ab772-5dd5-48dc-9e53-7ba0bbfcc49d,Money talks: Just the job,"The received wisdom is that work is becoming low-paid and precarious, with jobs lost to automation and the gig economy. The data say otherwise. What does the jobs boom in the rich world mean for the global economy? Also, will Alibaba’s plans to list in Hong Kong start a corporate shift away from Wall Street? And, the role of clearing houses in averting financial crises. Philip Coggan hosts  For information regarding your data privacy, visit <a href=""https://www.acast.com/privacy"">acast.com/privacy</a>","Tue, 28 May 2019 17:52:01 GMT",https://media.acast.com/theeconomistmoneytalks/moneytalks-justthejob/media.mp3
055ab772-5dd5-48dc-9e53-7ba0bbfcc49d,Money talks: When the chips are down,"How will the Trump administration’s restrictions affect Huawei—can the world’s second biggest smartphone maker adapt to not doing business with America? Michael Froman, a former US trade representative and the vice-chairman of MasterCard, discusses how private companies themselves can promote freer trade. And Jennifer Eberhardt, a professor of psychology, on the science of racial bias. Simon Long hosts  For information regarding your data privacy, visit <a href=""https://www.acast.com/privacy"">acast.com/privacy</a>","Tue, 21 May 2019 18:00:00 GMT",https://media.acast.com/theeconomistmoneytalks/moneytalks-whenthechipsaredown/media.mp3
055ab772-5dd5-48dc-9e53-7ba0bbfcc49d,Money talks: A US-China game of nerves,"Two-way trade between America and China hit $2bn a day last year. But the growing mistrust between the two countries is turning business from a safe space into a field of contention. David Rennie, The Economist’s Beijing bureau chief, has travelled across both countries and found that, with China’s daunting rise, making money is no longer enough to keep friendly relations.  For information regarding your data privacy, visit <a href=""https://www.acast.com/privacy"">acast.com/privacy</a>","Tue, 14 May 2019 20:42:23 GMT",https://media.acast.com/theeconomistmoneytalks/moneytalks-aus-chinagameofnerves/media.mp3
055ab772-5dd5-48dc-9e53-7ba0bbfcc49d,Money talks: Tech’s raid on the banks,"Digital disruption is coming to banking at last. Helen Joyce travels across Asia to see how fintechs like Ant Financial are transforming how people spend, save and invest their money, and asks whether traditional banks can catch up. Who will win the battle to be the bank of the future? And could having a bank in your pocket make your money safer?  For information regarding your data privacy, visit <a href=""https://www.acast.com/privacy"">acast.com/privacy</a>","Tue, 07 May 2019 16:50:57 GMT",https://media.acast.com/theeconomistmoneytalks/moneytalks-tech-sraidonthebanks/media.mp3
055ab772-5dd5-48dc-9e53-7ba0bbfcc49d,Money talks: Rise of the No Men,"Since the financial crisis, compliance officers in charge of minimising banks’ regulatory woes have never been more in demand. Will banks reach peak compliance? Also, author Caroline Criado Perez exposes what she calls “data bias in a world designed for men”. Also, after Avengers: Endgame broke box office records, will Disney Hulk smash the streaming competition later this year? Philip Coggan hosts  For information regarding your data privacy, visit <a href=""https://www.acast.com/privacy"">acast.com/privacy</a>","Tue, 30 Apr 2019 15:30:00 GMT",https://media.acast.com/theeconomistmoneytalks/moneytalks-riseofthenomen/media.mp3
055ab772-5dd5-48dc-9e53-7ba0bbfcc49d,Money talks: Waging bull,"As the debate about raising the minimum wage in America intensifies, it seems that wages for the lowest-paid Americans are already on the increase.&nbsp; Also, why is wage growth in the UK picking up at last? Finally, the most expensive homes in the world’s most desirable cities are becoming a bit less expensive.&nbsp; Simon Longs hosts  For information regarding your data privacy, visit <a href=""https://www.acast.com/privacy"">acast.com/privacy</a>","Tue, 23 Apr 2019 16:38:52 GMT",https://media.acast.com/theeconomistmoneytalks/moneytalks-wagingbull/media.mp3
055ab772-5dd5-48dc-9e53-7ba0bbfcc49d,Money talks: Big bank theory,"America’s largest banks reported earnings this week. Bank of America’s chief executive, Brian Moynihan, tells Anne McElvoy why he is bullish about the American economy and justifies his pay package. Also, can Goldman Sachs reinvent itself in the shadow of a scandal? And, Tiger Woods’s stroke of genius—for the business of golf. Simon Long hosts  For information regarding your data privacy, visit <a href=""https://www.acast.com/privacy"">acast.com/privacy</a>","Tue, 16 Apr 2019 16:42:21 GMT",https://media.acast.com/theeconomistmoneytalks/moneytalks-bigbanktheory/media.mp3
055ab772-5dd5-48dc-9e53-7ba0bbfcc49d,Money talks: Banking on independence,"It’s all change at the European Central Bank with its president, Mario Draghi, set to depart, along with two senior board members. As debate rumbles in America around central-bank independence, can new leadership at the ECB navigate the political shoals? Also, Airbus’s new boss seeks to capitalise as Boeing flounders. And, can the exorbitant cost of cross-border remittances be brought down? Simon Long hosts  For information regarding your data privacy, visit <a href=""https://www.acast.com/privacy"">acast.com/privacy</a>","Tue, 09 Apr 2019 17:23:37 GMT",https://media.acast.com/theeconomistmoneytalks/moneytalks-bankingonindependence/media.mp3
055ab772-5dd5-48dc-9e53-7ba0bbfcc49d,Money talks: Opioid scandal,"Purdue Pharma, a US company which makes OxyContin and is owned by members of the Sackler family, is at the eye of the opioid crisis. &nbsp;What next for the Sacklers and how similar is this storm to that which faced the tobacco industry in the 1990s? Also, the fading fortunes of European banks and NYC’s $100bn congestion problem. Simon Long hosts  For information regarding your data privacy, visit <a href=""https://www.acast.com/privacy"">acast.com/privacy</a>","Tue, 02 Apr 2019 17:00:59 GMT",https://media.acast.com/theeconomistmoneytalks/moneytalks-opioidscandal/media.mp3
055ab772-5dd5-48dc-9e53-7ba0bbfcc49d,Money talks: Too close to the Son,"Masayoshi Son reinvented investing — as he prepares to raise billions of dollars for Vision Fund 2, what are the governance questions? Chickenomics and how chicken became the rich world's most popular meat. And, our Bartleby columnist explores the role of charisma in good leadership.&nbsp; Rachana Shanbhogue hosts  For information regarding your data privacy, visit <a href=""https://www.acast.com/privacy"">acast.com/privacy</a>","Tue, 26 Mar 2019 17:46:51 GMT",https://media.acast.com/theeconomistmoneytalks/moneytalks-tooclosetotheson/media.mp3
055ab772-5dd5-48dc-9e53-7ba0bbfcc49d,Money talks: #Metoo in Economics,"A new survey published this week shows harassment and discrimination are widespread problems in the academic field of economics.&nbsp;Soumaya Keynes, our US Economics Editor, speaks to those in the field and Ben Bernanke, President of the American Economic Association, about their experiences and what can be done to achieve change  For information regarding your data privacy, visit <a href=""https://www.acast.com/privacy"">acast.com/privacy</a>","Tue, 19 Mar 2019 16:48:07 GMT",https://media.acast.com/theeconomistmoneytalks/moneytalks-metooineconomics/media.mp3
